sentence,isHedge
Thank you.,0
"Good afternoon, and thanks to everyone for joining us today.",0
"Speaking first is Apple's CEO, Tim Cook, and he'll be followed by CFO, Luca Maestri.",0
"After that, we'll open the call to questions from analysts.",0
"Please note that some of the information you'll hear during our discussion will consist of forward-looking statements, including without limitation, those regarding revenue, growth margins, operating expenses, other income and expense, taxes, future business outlook, and plans for capital return and debt issuance.",1
Actual results or trends could differ materially from our forecast.,1
"For more information, please refer to the risk factors discussed in Apples Form 10-K for 2015, the Form 10-Q for the first quarter of FY16, and the Form 8-K filed with the SEC today, along with the Associated Press release.",0
"Apple assumes no obligation to update any forward-looking statements or information, which speak as of their respective date.",0
"In addition, today's comments will refer to a metric we describe as the purchase value of services tied to our installed base.",0
"This is a non-GAAP measure, and a reconciliation to the corresponding GAAP measure can be found on our investor relations website at Apple.com/investor.",0
I'd now like to turn the call over to Tim for introductory remarks.,0
"Thanks, Nancy, and good afternoon, everyone, and thank you for joining us.",0
"Today, we're reporting the results of a very busy and challenging quarter, and we're also announcing an update to our capital return program.",0
"Revenue for the quarter was $50.6 billion, which was within our guidance range.",0
"Despite the pause in our growth, our results reflect excellent execution by our team in the face of ongoing macroeconomic headwinds in much of the world, and difficult year-over-year comparisons.",1
We saw continued currency weakness in the vast majority of our international markets.,0
"In constant currency, our revenue declined by 9% from last year, 400 basis points less than the reported decline of 13%.",0
"For the first half of the fiscal year, our revenue in constant currency was up 1% year-on-year.",0
"Despite challenges, there were a number of encouraging signs during the quarter.",1
Our installed base of over 1 billion active devices continued to grow strongly.,0
"We added a huge number of Android switchers and new-to-Mac customers, and we generated very strong growth from services.",0
"We sold 51.2 million iPhones in the quarter, consistent with the range of our own expectations, but lower than the exceptional year-ago quarter, when we saw an acceleration in iPhone upgrades, and 40% iPhone sales growth over the previous year.",0
"To provide some additional color, iPhone sales come from three sources: Customers who upgrade from previous iPhone models, customers who switch from Android and other operating systems, and customers who purchase a smart phone for the first time.",0
"As we look at each of these three sources of iPhone sales, we see a business that is healthy and strong.",0
"First, from an upgrade perspective, during the first half of this year, the upgrade rate for the iPhone 6s cycle has been slightly higher than what we experienced in the iPhone 5s cycle two years ago, but it is lower than the accelerated upgrade rate we saw with iPhone 6, which as you know, was a big contributor to our phenomenal revenue growth a year ago.",0
"Most importantly, our customers are incredibly loyal.",0
"A recent Kantar survey of US smart phone purchasers indicated a 95% iPhone loyalty rate, the highest ever measured for any smart phone.",0
"Second, we continued to see a very high level of customers switching to iPhone from Android and other operating systems.",0
"In fact, we added more switchers from Android and other platforms in the first half of this year than any other six-month period ever.",0
"And third, with only 42% smart phone penetration of the global handset market today, iPhone is still attracting millions of first-time smart phone buyers each quarter, especially from emerging markets.",0
"For example, in India, our iPhone sales were up 56% from a year ago.",0
"Next, I'd like to talk about services, which was our second-largest revenue generating category during the quarter.",0
"Setting aside the amount we received from a patent settlement in the December quarter, the March quarter services revenue was our highest ever.",0
Services revenue jumped 20% to $6 billion.,0
"App Store revenue was up 35% to beat last quarter's all-time record, and Apple Music continues to grow in popularity with over 13 million paying subscribers today.",0
"We feel really great about the early success of Apple's first subscription business, and our Music revenue has now hit an inflection point after many quarters of decline.",1
"The services business is powered by our huge installed base of active device, which crossed 1 billion units earlier this year.",0
"As we discussed on this call in January, those 1 billion-plus active devices are a source of recurring revenue that is growing independent of the unit shipments we report every three months.",0
"In fact, the purchase value of services tied to our installed base was a record $9.9 billion in the March quarter, up 27% over last year, accelerating from the 24% growth rate we reported in the December quarter.",0
"The reach of Apple Pay also continues to expand, following a very successful launch in China in the March quarter, and last week's roll-out in Singapore.",0
"Apple Pay is growing at a tremendous rate, with more than 5 times the transaction volume of a year ago, and 1 million new users per week.",0
"There are more than 10 million contactless ready locations in the countries where Apple Pay has launched today, including over 2.5 million locations now accepting Apple Pay in the United States, and more expansion of Apple Pay is coming soon.",0
"Turning to the Mac, we met our sell-in expectations, in addition to reducing channel inventory by about 100,000 unites.",1
"Overall, the Mac continues to attract  a large percentage of new customers.",0
"In our latest survey of major markets, over half of buyers were new to the Mac, and in some countries, the percentage is extremely high, like in China, where over 80% of customers were purchasing a Mac for the first time.",0
"We're confident in our Mac business, and our ability to continue to innovate and gain share in that area.",1
"Turning to the Apple Watch, unit sales met our expectations in the quarter.",0
"For some color on how we think about Apple Watch sales, we expected seasonality to be similar to the historical seasonality of iPod, which typically generated 40% or more of its annual unit sell-through in the December  quarter.",1
"We started shipping Apple  Watch just one year ago, and it has quickly become the best-selling and most loved smart watch in the world.",0
"In fact, unit sales of Apple Watch during its first year exceeded sales of iPhone in its first year.",0
"Last month, we refreshed the lineup for the spring with new bands and a new starting price point, and the response from customers has been great.",0
"Apple Watch is an increasingly essential part of user's lives, from responding to messages, managing calendars and navigating with maps, to helping them  be more fit.",0
"And in some cases, the heart rate sensor has even helped save lives.",0
We're really excited about the first year with Apple Watch.,1
"We have learned a lot, and we believe it has an exciting future ahead.",1
We announced some fantastic new products during the March quarter.,0
"iPhone SE became available on March 31, so none of its sales were reflected in our second-quarter results, but so far this quarter, we're seeing terrific customer response.",0
"iPhone SE is the most powerful four-inch phone ever, and it's a great option for customers all over the world who want a compact phone with advanced features, and a great price, without compromising performance.",0
"Demand has been very strong, and exceeds supply at this point, but we're working hard to get the iPhone SE into the hands of every customer who wants one, as quickly as possible.",0
The addition of the iPhone SE in the iPhone lineup places us in a better strategic position to attract even more customers into our ecosystem.,1
"We also unveiled the stunning 9.7 inch iPad Pro, with cutting-edge performance and our most advanced display yet.",0
"The reviews of our new iPad Pros have been great, and we are hearing from customers of the features and capabilities in the new Pros make them both the ultimate upgrade for iPad owners, and a great PC replacement.",0
"In the June quarter, we expect to see our best iPad revenue compare in over two years.",1
"iPad is the best-selling, best-reviewed and  most used tablet on the market.",0
"Customers tell us that they love iPad for its unique mix of portability, capability, and versatility, with over 1 million iPad apps in the App Store to help them work, play, learn, and create.",0
"We also announced Care Kit, a new software framework that developers can use to help people take a more active role in their health, by keeping track of their care plans, monitoring their symptoms and medication, and delivering the insights they need to make smart decisions about their health.",0
We're very excited about the ways iPhone and Apple Watch are helping people lead healthier lives.,0
"We believe there's great promise here for the future, and we are very interested in where this can take us.",1
"As always, we are contributing to society beyond our products, promoting the use of renewable energy across our facilities and inside our supply chain, and developing cutting-edge technologies to revolutionize recycling in the materials we use.",0
"We are unwavering in our commitment to protect the security and privacy of our customers and their data, and we are actively promoting inclusion and equality across our business.",0
"As we continue through the June quarter, I'd like to remind you that we measure the health of customer demand based on sell-through.",0
"Despite ending Q2 within our channel inventory targets, in light of the macroeconomic environment we plan to lower our channel inventories in the June quarter.",0
This will impact our reported revenue in Q3.,0
Luca will provide more details on this in his commentary.,0
"But before turning over the call to him, I will summarize by saying that the future of Apple is very bright.",1
Our product pipeline has amazing innovations in store.,1
We are very excited about bringing together developers for our four major platforms at our worldwide developers conference in June.,0
"We are forging ahead with important investments in research and development, in our infrastructure, and in our supply chain.",0
"We've made 15 acquisitions in the last four quarters to accelerate our product and services roadmaps, and we are always on the lookout for companies with great technology, talent, and strategic fit.",0
"Creating value for shareholders by developing great products and services that enrich people's lives will always be our top priority, and the key factor driving our investments and capital allocation decisions.",0
"As our business continues to generate high levels of free cash flow, we are in the fortunate position to expand our capital return program again this year, as we have done each year since we started the program four years ago.",0
"Today, we are announcing an extension of the timeframe of the program by four quarters through March of 2018, and we are expanding the total program size from $200 billion to $250 billion.",0
Luca has more details on this announcement and our results for the March quarter.,0
Luca?,0
"Thank you, Tim, and good afternoon, everyone.",0
Let me start with the March quarter results.,0
"Revenue for the quarter landed within our guidance range at $50.6 billion, compared to $58 billion in the year-ago quarter, a decline of 13%.",0
"As we had expected, our comparisons to last year were influenced by the continued strength of the US dollar against foreign currencies.",1
"That being said, in constant currency, our revenue declined by 9%.",0
"On a geographic basis, in Asia, our revenue grew strongly in Japan, but it declined in greater China and the rest of Asia-Pacific.",0
However our business in these two regions is faring better than the numbers might suggest.,1
"We had significant channel inventory reductions and currency weakness, which affected our reported revenue for both of these segments.",0
"In mainland China, revenue was down 11%, and the decline was 7% in constant currency terms.",0
"Keep in mind that we were up against an extremely difficult year-ago compare, when our mainland China revenue grew 81%.",0
"We remain very optimistic about the China market over the long-term, and we are committed to investing there for the long run.",1
"Gross margin was 39.4%, near the high-end of our guidance range, thanks to strong cost performance.",0
"Operating margin was 27.7% of revenue, and net income was $10.5 billion.",0
"Diluted earnings per share were $1.90, and cash flow from operations was strong, at $11.6 billion.",0
"For details by product, I start with iPhone.",0
"We sold 51.2 million iPhones in the quarter, compared to 61.2 million in the year-ago quarter, a decline of 16%.",0
"It was a particularly challenging comparison to the record quarter a year ago, when iPhone 6 grew 40% as we entered last March quarter, and supply demand imbalance, which was recovered during the quarter.",0
"Also, this year we reduced channel inventory by 450,000 units, while we increased inventory by 1 million units a year ago.",0
We have exited the quarter with in our five to seven-week target range for channel  inventory.,1
"iPhone ASV was $642 compared to $659 in the year ago quarter, with weak international currencies and very popular mid-tier and entry offerings contributing to the difference year-over-year.",0
iPhone's momentum in business markets continues to be very impressive.,0
"A recent survey by 451 Research, formerly known as ChangeWave, found that among US corporate buyers planning to purchase smart phones in the June quarter, 78% planned to purchase iPhones.",0
That's the highest June quarter iPhone purchase intent ever measured by the survey and 5 points higher than a year ago.,0
"Turning to services, we generated $6 billion in revenue, an increase of 20% over the March quarter last year, thanks primarily to the continued strong performance of the App Store, with revenue growing 35% to a new all-time high.",0
"According to App Annie, the App Store generated 90% more global revenue than Google Play in the March quarter, up from a 75% lead in 2015.",0
"Among our customers who purchased apps and content from our iTunes Stores, the average amount spent per customer reached a new all-time record in the March quarter.",0
"Next, I'd like to talk about the Mac.",0
"We sold 4 million Macs compared to 4.6 million last year, a decline of 12%.",0
"It was a challenging quarter for personal computer sales across the industry, but we believe we gained market share.",1
"Despite the overall market slowdown, we generated double-digit market growth in a number of markets, including Russia, Korea, Singapore, Taiwan, and the UAE.",0
"Just last week, we updated the MacBook, our thinnest and lightest Mac, with the latest processors, faster graphics, fastest flash storage, and longer battery life.",0
We think our customers are going to love this update.,1
We ended the quarter within our four to five-week target range for Mac channel inventory.,0
"Turning to iPad, we sold 10.3 million compared to 12.6 million in the year ago quarter.",0
"We also reduced channel inventory by about 200,000 units, and we exited the quarter within our five to seven-week target range.",1
"In the same segments of the public market where we compete, we continue to be highly successful.",0
Recent data from NPD indicates that iPad had 78% share of the US market for tablets priced above $200.,0
"And the latest data published by ABC indicates that iPad accounts for 72% of the US commercial tablet market, comprising business, government, and education.",0
iPad customer metrics are also extremely positive.,0
"In February, 451 Research measured a 97% consumer satisfaction rate for iPad Air 2, and among consumers planning to purchase a tablet within the next six months, 59% planned to purchase an iPad, more than 3 times the purchase intention rate of the next highest brand measured.",0
"Corporate buyers reported a 94% satisfaction rate for iPad, and a June quarter purchase intent of 71%.",0
"Revenue from other products grew 30% over the last year, thanks to Apple Watch.",0
"We have expanded distribution to 60 countries, and introduced bands in beautiful new colors for spring, so customers can personalize their watches in more ways, with a range of colors, styles, and materials.",0
"Our customers are very happy with Apple Watch, with 451 Research measuring 94% customer satisfaction.",0
We're also making great progress with our enterprise initiatives.,1
IBM now has engagements for more than 200 deployments of native iOS apps for large enterprise customers to accelerate mobile transformation.,0
"Our mobility partner program also continues to grow, with 108 partners across 20 countries.",0
We see continued broad industry adoption of native iOS apps to transform how professionals do their work and serve their customers.,0
"For example, retail bankers are using iOS apps on iPads to greet and onboard customers, reduce queue times, and improve the customer experience.",0
"And in hospitals, using doctors and nurses are using iOS Apps on iPhone and iPad to share and communicate more effectively, so that they can spend more time with patients, and less time on administrative tasks.",0
Let me now turn to our cash positions.,0
"We ended the quarter with $232.9 billion in cash plus marketable securities, a sequential increase of $17.2 billion.",0
"$208.9 billion of this cash, or 90% of the total, was outside the United States.",0
"We issued $15.5 billion in US dollar denominated notes during the quarter, including our first green bond tranche to fund initiatives such as renewable energy and environmental design projects.",0
We exited the March quarter with $72 billion in term debt.,0
"We returned   $10 billion to investors during the quarter, including $2.9 billion in dividends and equivalents, and $7 billion on purchases of 71.8 million Apple shares, to open market transactions.",0
"We have now completed over $163 billion of the current $200 billion capital return program, including $117 billion in share repurchases.",0
"As Tim mentioned, today we are announcing the latest update to our program, which we are increasing to a total of $250 billion.",0
"Once again, we are allocating the majority of the expansion of the program to share repurchases, given our strong confidence in Apple's future, and the value we see in our stock.",1
"The Board has increased the share repurchase authorization by $35 billion, raising it from the current $140 billion level to $175 billion.",0
"We will also continue to net share settle, less the employee restricted stock units.",0
"We also know that the dividend is very important to many of our investors who value income, and we are raising it for the fourth time in less than four years.",0
"The quarterly dividend will grow from $0.52 per share to $0.57 per share, an increase of about 10%.",1
"This is effective with our next dividend, which the Board has declared today is payable on May 12, 2016, to shareholders of record as of May 9, 2016.",0
We continue to plan for annual dividend increases going forward.,1
"With $12 billion in annual dividend payments, we are proud to be one of the largest dividend payers in the world.",0
"In total, with this updated program, during the next eight quarters, we expect to return $87 billion to our investors, which represents about 15% of our market cap at the current stock price.",1
"As in the past, we expect to fund our capital return program with US cash, future US cash flow generation and borrowing from both domestic and international debt markets.",1
"We will continue to review capital allocation regularly, and solicit input on our program from a broad base of shareholders.",0
"This allows us to be thoughtful about the size, the mix, and the face of the program.",0
"As we move ahead into the June quarter, I'd like to review our outlook, which includes the types of forward-looking information that Nancy referred to at the beginning of the call.",1
We expect revenue to be between $41 billion and $43 billion.,1
"The revenue guidance implies a year-over-year decline, as we lap an incredibly strong June quarter last year, when revenue grew 33%, due in part to accelerated iPhone upgrade purchases.",0
"This tough compare is compounded by the continued weak macro environment this year, and the strong US dollar, which affects our revenue growth in international markets.",0
"Embedded in this guidance is a planned channel inventory reduction worth  over $2 billion, as we have elected to be prudent about our channel inventory position, given the current macro environment.",1
The guidance also reflects a range of possible scenarios related to how quickly we can get into supply-demand balance for iPhone SE.,1
"Due to these factors, our expected demand is greater than the revenue range implies.",1
"Sequentially, our guidance implies a revenue decline of 15% to 19%, which is comparable to the 17% sequential decline that we've averaged from the March to June quarter for the last three years, despite the anticipated channel inventory adjustments I just described.",1
"We expect seasonal sequential declines in iPhone and iPad sales, and a sequential increase in Mac sales.",1
"We also expect iPhone ASPs to decline sequentially as we get further from the launch of iPhone 6s and 6s Plus, and as iPhone SE enters the mix.",1
We know that our revenue guidance falls short of market estimates for the third quarter.,0
"We believe the difference counts primarily from three areas: First, the $2 billion plus channel inventory reduction I just mentioned.",1
"Second, the effect of the channel inventory reduction, and the launch of iPhone SE on iPhone ASPs, as well as the current constrained supply of iPhone SE.",0
"Third, different estimates for Mac, which we expect to grow sequentially at the rate similar to what we have experienced in the past June quarters.",1
We expect gross margins to be between 37.5% and 38%.,1
"We expect continued cost improvements to be more than offset by the sequential loss of leverage from lower revenue, and a differing mix of products.",1
We expect OpEx to be between $6 billion and $6.1 billion.,1
We expect OI&E to be about $300 million.,1
And we expect the tax rate to be about 25.5%.,1
"With that, I'd like to open the call to questions.",0
"Thank you, Luca.",0
"(Caller Instructions) Operator, may we have the first question, please?",0
Questions and Answers,0
"Simona, let me give you the data point on the sell through and then I'll let Tim answer the strategic question.",0
We had a channel inventory reduction that was worth a bit less than $800 million a year ago.,0
"Simona, this is Tim.",0
In terms of do I think the smart phone market is mature?,1
"I think that the market, as you know, is currently not growing.",1
"However, my view of that is that's an overhang of the macroeconomic environment in many different places in the world.",1
"We're very optimistic that this too shall pass, and that the market and particularly us will grow again.",1
"The reason that we're optimistic is we look at sort of the three places that iPhone sales come from, and from an upgrade point of view, as I mentioned in my comments, we compare favorably, slightly better than the upgrade cycle that we saw on the iPhone 5s.",0
"We are lower than the iPhone 6, but I think all of us know that was an extraordinary cycle, that accelerated upgrades from 2016 into 2015, and so that comparable will be tough for this year, but that's a transitory thing.",1
"As we look at switchers, we're extremely excited that for the first half we have set a record from switchers from other platforms.",1
"The largest we've ever seen in any six month period before, so we've got traction there.",0
"And then on emerging markets, if you take a look at India, we grew by 56%, and we're placing increasing emphasis in these areas, where it's clear there will be disproportionate growth versus the more developed areas.",1
"The next thing is with the iPhone SE, we have seen our ability to attract even more customers into the platform, with incredible product that is at a new price point for us, with the latest technology.",0
And so we're optimistic about attracting even more customers with that.,1
"We also look at our pipeline, and were very excited about what's in our pipeline.",1
All of those things make me optimistic.,1
"Your other question was on M&A, and regardless of the first, we're always looking in the market about things that could complement things that we do today, become features in something we to, or allow us to accelerate entry into a category that we are excited about.",1
"As I have said before, our test is not on the size.",0
We would definitely buy something larger than we have bought thus far.,1
"It's more about the strategic fit, and whether it's  a great technology and great people.",0
"We continue to look, and we stay very active in the M&A market.",0
Thank you.,0
Could we have the next question please?,1
I think the SE is attracting two types of customers.,1
"One is   customers that wanted the latest technology, but wanted it in a more compact package.",0
And we clearly see even more people than we thought in that category.,1
