sentence,isHedge
"Secondly, it's attracting people aspire to own an iPhone, but couldn't quite stretch to the entry price of the iPhone, and we've established a new entry.",0
"I think both of these markets are very, very important to us, and we are really excited about where it can take us.",1
"I do think that we will be really happy with the new to iPhone customers that we see from here, because of the early returns we've had.",1
"We are currently supply constrained, but we'll be able to work our way out of this at some point.",1
But it's great to see the overwhelming demand for it.,0
I will let Luca comment on the ASPs.,0
"On the ASPs, Gene we mentioned that we were going to be down sequentially, and this is really the combination of two factors.",0
"So when we go from the March quarter to the June quarter, is the fact that we are having the SE entering the mix, and that obviously is going to have a downward pressure on ASP, and also this channel inventory reduction that we have talked about, obviously the channel inventory reduction will come from higher-end models, and that is also affecting the sequential trend on ASPs.",1
"The question on services, when we look at our services business, obviously growing very well across the board.",0
"The biggest element, and the part of the services business that is growing very well, we mentioned 35%, is the App Store.",0
"It's interesting for us that our music business, which had been declining for a number of quarters, now that we have both a download model and a streaming model, we have now hit an inflection point, and we believe that this would be the bottom, and we can start growing from there over time.",1
"We have many other services businesses that are doing very well, we have an iCloud business that is growing very quickly.",0
"Faster than the App Store, from a much lower base but I think it's important for us as we continue to develop these businesses.",1
Tim have talked about Apple Pay.,0
"It doesn't provide a meaningful financial contribution at this point, but as we look at the amount of transactions that go into Apple Pay right now, and we think ahead for the long-term, that could be an interesting business for us, as well.",1
"From a profitability standpoint, we have mentioned last time that when you look at it on a gross basis, so in terms of purchase value of these services, the profitability of the business is similar to Company average.",0
"Of course, when you met out the amount that is paid to developers, and you look at it, in terms of what is reported in our P&L, obviously that business has a profitability that is higher than Company average.",0
"We don't get into the specifics of specific products or services, but it is very clear it is significantly higher than Company average.",1
"Thanks, Gene.",0
Could we have the next question please?,1
"Katy, clearly the commodity environment remains quite favorable, and we continue to expect cost improvements.",1
"The other dynamics that you have mentioned are still there, obviously what is different, and particularly as we look at it on a sequential basis coming out of the March quarter, we would have loss of leverage, and that obviously is going to have a negative impact on margins.",1
The other factor that's important to keep in mind is this different mix of products.,0
"Particularly when you look at iPhone, what I was mentioning to Gene earlier, I think we've got a couple of things that are affecting not only ASPs, but obviously, they also affects margins.",1
"And it's the fact that we have a channel inventory reduction at the top end of the range, and we've got the introduction of the iPhone SE at the entry level of the range.",0
"And so when you take into account those factors, those are the big elements that drive our guidance range right now.",0
"Katy, in the short term, let me just make a couple of comments on the developed markets, just to make sure this is clear.",0
"If you look at our installed base of iPhone today versus two years ago, it's increased by 80%.",1
"When you think about upgrade cycles, upgrade cycles would have varying rates on it.",1
"As I talked about on the comments, the iPhone 6s rate, upgrade rate is slightly higher than the iPhone 5s, but lower than the iPhone 6.",0
But the other multiplier in that equation is obviously the size of the installed base.,0
"The net of the idea is that I think there's still really, really good business in the developed markets, so I wouldn't want to write those off.",1
"It's our job to come up with great products that people desire, and also to continue to attract over Android switchers.",0
"With our worldwide share there's still quite a bit of room in the developed markets, as well.",0
"From an India point of view, if you look at India, and each country has a different story a bit, but the things that have held not only us back, perhaps, but some others as well, is that the LTE rollout with India just really begins this year.",1
So we will begin to see some really good networks coming on in India.,0
"That will unleash the power and capability of the iPhone, in a way that an older network, 2.5G or even some 3G networks, would not do.",1
"The infrastructure is one key one, and the second one is building the channel out.",0
"Unlike the US as an example, where the carriers in the US sell the vast majority of phones that are sold in the United States, in India, the carriers in general sell virtually no phones, and it is out in retail, and retail is many, many different small shops.",0
We've been in the process.,0
It's not something we just started in the last few weeks.,0
"We've been working in India now for a couple of years or more, but we've been working with great energy over the last 18 months or so, and I am encouraged by the results that we're beginning to see there, and believe there's a lot, lot more there.",1
"It is already the third largest smart phone market in the world, but because the smart phones that are working there are low-end, primarily because of the network and the economics, the market potential has not been as great there.",0
I  view India as where China was maybe 7 to 10 years ago from that point of view.,1
I think there's a really great opportunity there.,1
"Thank you, Katy.",0
Could we have the next question please?,1
"Toni, it's Tim.",1
Let me see if I can address your question.,1
"The channel inventory reduction that Luca referred to, the vast, vast majority of that is in iPhone.",0
That would affect the unit compare that you maybe thinking about.,1
"The iPhone SE, we are thrilled with the response that we've seen on it.",0
"It is clear that there is a demand there, even much beyond what we thought, and so that is really why we have the constraint that we have.",1
Do I think it will be like the iPad Mini?,1
"No, I don't think so.",1
I don't see that.,0
"I think the tablet market in general, one of the challenges with the tablet market is that the replacement cycle is materially different than in the smart phone market.",1
"As you probably know, we haven't had an issue in customer satisfaction on the iPad.",1
"It is incredibly high, and we haven't had an issue with usage of the iPad.",0
The usage is incredibly high.,0
"But the consumer behavior there is you tend to hold on for very long period of time, before an upgrade.",0
"We continue to be very optimistic on the iPad business, and as I have said in my remarks, we believe we are going to have the best compare for iPad revenue this quarter that we have quite some time.",1
"We will report back in July on that one, but I think iPhone has a particularly different kind of cycle to it than the tablet market.",1
There's a lot there.,0
"Let me just say I don't recall saying the things that you said I said about the upgrade cycle, so let me get that out of the way.",0
"Now let me describe without the specific numbers, the iPhone 6s upgrade cycle that we have measured for the first half of this year, so the first six months of our fiscal year to be precise, is slightly better than the rate that we saw with the iPhone 5s two years ago, but it's lower than the iPhone 6.",0
"I don't mean just a hair lower, it's a lot lower.",0
"Without giving you exact numbers, if we would have the same rate on 6s that we did 6, there would -- it will be time for a huge party.",1
It would be a huge difference.,1
"The great news from my point of view is, I think we are strategically positioned very well, because we have announced the SE, we are attracting customers that we previously didn't attract.",1
"That's really great, and this tough compare eventually isn't the benchmark.",0
"The install base is up 80% over the last two years, and so all of those I think bode well, and the switcher comments I made earlier, I wouldn't underestimate that, because that's very important for us in every geography.",1
Thanks for the question.,0
"Thanks, Toni.",0
Can we have the next question please?,0
"Shannon, thanks for the question.",0
"If you take greater China, we include Taiwan, Hong Kong, and mainland China in the greater China segment that you see reported on your data sheet.",0
"The vast majority of the weakness in the greater China region sits in Hong Kong, and our perspective on that is, it's a combination of the Hong Kong dollar being pegged to the US dollar, and therefore it carries the burden of the strength of the US dollar, and that has driven tourism, international shopping and trading down significantly compared to what it was in the year ago.",0
"If you look at mainland China, which is one that I am personally very focused on, we are down 11% in mainland China, on a reported basis.",0
"On a constant currency basis, we are only down 7%, and the way that we really look at the health or underlying demand is look at sell-through, and if you look at there, we were down 5%.",0
Keep in mind that is down 5% on comp a year ago that was up 81%.,0
"As I  back up from this and look at the larger picture, I think China is not weak, as has been talked about.",1
"I see China as -- may not have the wind at our backs that we once did, but it's a lot more stable than what I think is the common view of it.",1
We remain really optimistic on China.,0
We opened seven stores there during the quarter.,0
We are now at 35.,0
"We will open 5 more this quarter to achieve 40, which we had talked about before.",0
"And the LTE adoption continues to rise there, but it's got a long way ahead of it.",1
"And so we continue to be really optimistic about it, and just would ask folks to  look underneath the numbers at the details in them before concluding anything.",1
Thanks for the question.,0
It is Luca.,0
"Of course, we think about it.",1
"We think about it a lot, and so when you look at our results, for example, our OpEx for the quarter, for the March quarter was up 10%, which is the lowest rate that you have seen in years.",1
"And when you look within OpEx, you actually see two different dynamics.",0
"You see continued significant investments in research and development, because we really believe that's the future of the Company.",1
We continue to invest in initiatives and projects ahead of revenue.,0
We had a much broader portfolio that we used to have.,0
"We do much more in-house technology development than we used to do a few years ago, which we think is a great investment for us to make.",1
"And so that parts we didn't need to protect, and we want to continue to invest in the business, right?",0
"And then when you look at our SG&A portion of OpEx for the March quarter, it was actually down slightly.",0
"So obviously we think about it, and of course we look at our revenue trends, and we take measures accordingly.",1
"When you look at the guidance that we provided for the June quarter, that 10% year-over-year increase that I mentioned to you for the March quarter goes down to a range of 7% to 9% up, and again, the focus is on making investments in Road and continuing to run SG&A extremely tightly, and in a very disciplined way.",0
"As you know, our E2R, expense to revenue ratio, is around 10%.",1
"It's something that we are very proud of, it's a number that is incredibly competitive in our industry, and we want to continue to keep it that way.",0
"At the same time, we don't want to under-invest in the business.",0
"Thank you, Shannon.",0
Could we have the next question please?,1
"The most important thing for us, Steve, is that we want to have a great customer experience, so overwhelmingly, the thing that drives us are to embark on services that help that, and become a part of the ecosystem.",0
"The reality is that in doing so, we have developed a very large and profitable business in the services area, and so we felt last quarter and working up to that, that we should pull back the curtain so that people could -- our investors could see the services business, both in terms of the scale of it, and the growth of it.",1
"As we said earlier, the purchase value of the installed base services grew by 27% during the quarter, which was an acceleration over the previous quarter, and the value of it hit -- was just shy of $10 billion.",0
"It's huge, and we felt it was important to spell that out.",0
What we've seen is that it depends on what you compare it to.,0
"If you compare to the 5s, what we are seeing is the upgrade rate today is slightly higher, or that there are more people upgrading, if you will, in a similar time period, in terms of a rate, than the 5s.",1
"But if you compare to 6, you would clearly arrive at the opposite conclusion.",0
"I think it depends on people's reference points, and we thought it very important in this call to be very clear and transparent about what we're seeing.",1
"I think in retrospect, you could look at it and say, maybe the appropriate measure is more to the 5s, and I think everybody intuitively thought that the upgrades were accelerated with the 6, and in retrospect, when you look at the periods, they clearly were.",1
"Thanks, Steve.",0
"Could we have our next question, please?",1
"I think you're probably indirectly asking about our trough comment, if you will, from last quarter.",1
"And when we made that, we did not contemplate or comprehend that we were going to make a $2 billion-plus reduction in channel inventory during this quarter.",0
"So if you factor that in and look at true customer demand, which is the way that we look at internally, I think you'll find a much more reasonable comparison.",1
"Yes, Rod, these are new regulations, and we are in the processing of assessing them.",0
"Frankly from first read, we don't anticipate that they are going to have any material impact on our tax situation.",1
"Some of them relate to inversion transactions, obviously that's not an issue for us.",0
"Some of them are around internal debt financing, which is not something that we use, so we don't expect any issue there.",1
"As you know, we are the largest US taxpayer by a wide margin, and we already pay full US tax on all the profits from the sales that we make in the United States, so we don't expect them to have any impact on us on tax reform.",0
"I will let Tim continue to  provide more color, but we've been strong advocates for comprehensive corporate tax reform in this country.",0
We continue to do that.,0
"We think a reform of the tax code would have significant benefits for the entire US economy, and we remain optimistic that we are going to get to a point where we can see that tax reform enacted.",1
"At that point in time, of course, we would have much more flexibility around optimizing our capital structure, and around providing more return of capital to our investors.",1
"The only thing I would add, Rod, is I think there are a growing number of people in both parties that would like to see comprehensive reform, and so I'm optimistic that it will occur.",1
It's just a matter of when and that's difficult to say.,1
But I think most people do recognize that it is in the US's interest to do this.,0
"Thank you, Rod.",0
"A replay of today's call will be available for two weeks as a podcast on the iTunes Store, as webcast on Apple.com/investor and via telephone.",0
"And the numbers for the telephone replay are 888-203-1112, or 719-457-0820, and please enter confirmation code 7495552.",0
These replays will be available by approximately 5:00 PM Pacific time today.,1
"Members of the press with additional questions can contact Kristin Huguet at 408-974-2414, and financial analysts can contact Joan Hoover or me with additional questions.",0
"Joan is at 408-974-4570, and I am at 408-974-5420.",0
Thanks again for joining us.,0
